{
  "contractVersion": 1,
  "correlation": {
    "requestId": "req-0001",
    "userId": "user-0001"
  },
  "toolCallId": "call-0001",
  "toolName": "ui.propose_generative_ui_plan",
  "arguments": {
    "observationId": "obs-0001",
    "layoutKind": "card_grid",
    "sourceCollectionHandles": ["collection-results"],
    "selectedFields": ["title", "price", "image"],
    "groupBy": null,
    "orderBy": { "field": "price", "direction": "asc" },
    "filters": [],
    "detailRegionHandles": [],
    "mediaPlacement": "leading",
    "provenance": { "sourceUrl": "https://example.com/search?q=hotels", "retrievedAt": "2026-08-22T12:00:00Z" },
    "freshness": "live",
    "warnings": [],
    "localInteractionIntents": [],
    "externalWorkflowIntents": []
  }
}
